<?xml version="1.0"?>
<xs:schema xmlns:xs="http://www.w3.org/2001/XMLSchema"
targetNamespace="http://www.hp.com"
xmlns="http://www.hp.com"
elementFormDefault="qualified" >

<xs:element name="display">
	<xs:complexType>
		<xs:sequence>
			<!-- Mandatory name comes first. This is the dentifying name of the model. -->
			<xs:element name="model" type="xs:string" />

			<!-- 

			The type of input this display device takes by default. 
			If the device connectes using a digital interface, then use "digital". All flat panels will be by default digital.
			Digital interfaces are connected using either DVI-D or "DisplayPort". Avoid usage of DVI-I cables. This may make the GPU
			switch to using analog signals.
			If the device connects using a VGA cable, use "analog". All CRT displays are analog.
			-->
			<xs:element name="input" > 
				<xs:simpleType>
					<xs:restriction base="xs:string">
						<xs:enumeration value="digital" />
						<xs:enumeration value="analog" />
					</xs:restriction>
				</xs:simpleType>
			</xs:element>

			<!-- 

			If you can get the EDID for this device, then use it here. Else be prepared to specify
			modelines

			-->
			<xs:element name="edid" minOccurs="0" maxOccurs="1" type="xs:string" />

			<!-- If you have the EDID bytes, feel free to use them too! -->
			<xs:element name="edidBytes" minOccurs="0" maxOccurs="1" type="xs:string" />

			<!-- This name should match the name exposed in the EDID -->
			<xs:element name="edid_name" type="xs:string" minOccurs="0" maxOccurs="1" />

			<xs:element name="hsync" minOccurs="0" maxOccurs="1" > <!-- If EDID is not specified, the sync value will be used from this -->
				<xs:complexType>
					<xs:sequence>
						<xs:element name="min" type="xs:string" />
						<xs:element name="max" type="xs:string" />
					</xs:sequence>
				</xs:complexType>
			</xs:element>

			<xs:element name="vrefresh" minOccurs="0" maxOccurs="1" > <!-- If EDID is not specified, the sync value will be used from this -->
				<xs:complexType>
					<xs:sequence>
						<xs:element name="min" type="xs:string" />
						<xs:element name="max" type="xs:string" />
					</xs:sequence>
				</xs:complexType>
			</xs:element>

			<xs:element name="dimensions" minOccurs="0" maxOccurs="1"> <!-- physical dimensions of the display -->
				<xs:complexType>
					<xs:sequence>
						<xs:element name="width" type="xs:float" /> <!-- width in mm -->
						<xs:element name="height" type="xs:float" /> <!-- height in mm -->
						<xs:element name="bezel" minOccurs="0" maxOccurs="1">
							<xs:complexType>
								<xs:sequence>
									<xs:element name="left" type="xs:float" />
									<xs:element name="right" type="xs:float" />
									<xs:element name="bottom" type="xs:float" />
									<xs:element name="top" type="xs:float" />
								</xs:sequence>
							</xs:complexType>
						</xs:element>
					</xs:sequence>
				</xs:complexType>
			</xs:element>

			<xs:element name="default_mode" type="xs:string" /> <!-- The default mode to choose if none is specified. Must be in the list below -->

			<xs:element name="mode" minOccurs="0" maxOccurs="unbounded" >
				<xs:complexType>
					<xs:sequence>
						<xs:element name="type" type="xs:string" />
						<xs:element name="alias" type="xs:string" minOccurs="1" maxOccurs="unbounded" />
						<xs:element name="width" type="xs:nonNegativeInteger" />
						<xs:element name="height" type="xs:nonNegativeInteger" />
						<xs:element name="refresh" type="xs:nonNegativeInteger" />
						<xs:element name="value" type="xs:string" minOccurs="0" maxOccurs="1" /> <!-- value depends on 'type'. Can be a modeline or empty at this point -->
						<xs:element name="bezel" minOccurs="0" maxOccurs="1"> <!-- per resolution bezel, in pixels -->
							<xs:complexType>
								<xs:sequence>
									<xs:element name="left" type="xs:nonNegativeInteger" /> <!-- note : all values in pixels. Any value specified here will override the computed bezel -->
									<xs:element name="right" type="xs:nonNegativeInteger" />
									<xs:element name="bottom" type="xs:nonNegativeInteger" />
									<xs:element name="top" type="xs:nonNegativeInteger" />
								</xs:sequence>
							</xs:complexType>
						</xs:element>
					</xs:sequence>
				</xs:complexType>
			</xs:element>

		</xs:sequence>
	</xs:complexType>
</xs:element>

</xs:schema>
