<?xml version="1.0" ?>

<display
 xmlns="http://www.hp.com"
 xmlns:xsi="http://www.w3.org/2001/XMLSchema-instance"
 xsi:schemaLocation="http://www.hp.com /opt/vizstack/share/schema/displayconfig.xsd" >
	<model>Generic Stereo CRT</model>
	<input>analog</input>
	<hsync>
		<min>30</min>
		<max>150</max>
	</hsync>
	<vrefresh>
		<min>50</min>
		<max>120</max>
	</vrefresh>
	<default_mode>1280x1024_110</default_mode>
	<!-- All modelines generated by GTF. Differ in some decimal digits from the SVA modelines !-->
	<mode>
		<type>modeline</type>
		<alias>1280x1024_110</alias>
		<width>1280</width>
		<height>1024</height>
		<refresh>110</refresh>
		<value>211.22  1280 1376 1520 1760  1024 1025 1028 1091 -HSync +Vsync</value> <!-- 1280x1024 @ 110.00 Hz (GTF) hsync: 120.01 kHz; pclk: 211.22 MHz -->
	</mode>
	<mode>
		<type>modeline</type>
		<alias>1920x1200_110</alias>
		<width>1920</width>
		<height>1200</height>
		<refresh>110</refresh>
		<value>373.38  1920 2072 2288 2656  1200 1201 1204 1278  -HSync +Vsync</value> <!-- 1920x1200 @ 110.00 Hz (GTF) hsync: 140.58 kHz; pclk: 373.38 MHz !-->
	</mode>
	<mode>
		<type>modeline</type>
		<alias>1400x1050_110</alias>
		<width>1400</width>
		<height>1050</height>
		<refresh>110</refresh>
		<value>237.32  1400 1512 1664 1928  1050 1051 1054 1119  -HSync +Vsync</value> <!-- 1400x1050 @ 110.00 Hz (GTF) hsync: 123.09 kHz; pclk: 237.32 MHz !-->
	</mode>
	<mode>
		<type>modeline</type>
		<alias>1280x960_110</alias>
		<width>1280</width>
		<height>960</height>
		<refresh>110</refresh>
		<value>198.05  1280 1376 1520 1760  960 961 964 1023  -HSync +Vsync</value> <!-- 1280x960 @ 110.00 Hz (GTF) hsync: 112.53 kHz; pclk: 198.05 MHz !-->
	</mode>
	<mode>
		<type>modeline</type>
		<alias>1152x900_110</alias>
		<width>1152</width>
		<height>900</height>
		<refresh>110</refresh>
		<value>167.10  1152 1240 1368 1584  900 901 904 959  -HSync +Vsync</value> <!-- 1152x900 @ 110.00 Hz (GTF) hsync: 105.49 kHz; pclk: 167.10 MHz !-->
	</mode>
	<mode>
		<type>modeline</type>
		<alias>1024x768_110</alias>
		<width>1024</width>
		<height>768</height>
		<refresh>110</refresh>
		<value>125.41 1024 1096 1208 1392  768 769 772 819  -HSync +Vsync</value> <!-- 1024x768 @ 110.00 Hz (GTF) hsync: 90.09 kHz; pclk: 125.41 MHz !-->
	</mode>
	<mode>
		<type>modeline</type>
		<alias>800x600_60</alias>
		<width>800</width>
		<height>600</height>
		<refresh>110</refresh>
		<value>75.47  800 848 936 1072  600 601 604 640  -HSync +Vsync</value> <!-- 800x600 @ 110.00 Hz (GTF) hsync: 70.40 kHz; pclk: 75.47 MHz !-->
	</mode>
	<mode>
		<type>modeline</type>
		<alias>640x480_60</alias>
		<width>640</width>
		<height>480</height>
		<refresh>110</refresh>
		<value>47.76  640 680 744 848  480 481 484 512  -HSync +Vsync</value> <!-- 640x480 @ 110.00 Hz (GTF) hsync: 56.32 kHz; pclk: 47.76 MHz !-->
	</mode>
</display>
